{"assumption_set_hash":"sha256:c0e3ca17751aef5bf9dbf4c5bdf1c4c2eedbbbac34afc66678951df7564ac5fd","assumptions":[{"assumption_id":"f2-spending","concept":"government_spending","direction":"down","magnitude":-2,"magnitude_source":"assumed_default","notes":"fixture の既定値（観測値ではない）。","unit":"level または ratio to GDP"},{"assumption_id":"f2-tax-zero","concept":"tax","direction":"none","magnitude":0,"magnitude_source":"assumed_default","notes":"『税は変化しない』という明示的な主張。","unit":"ratio（税率）または level（定額税）"}],"content_hash":"sha256:0131b8ab53f607d4fb66d9dd10700c0cca874d3b92593d0dbf27dad3d8f4230f","family":"fiscal_consolidation","fre_context":{"as_of":"2026-09-30","constraint_pressure":0.47,"context_identity":"sha256:29a8061e151be188076a455586fe85618fa232a5ed2e9a9148cd12d1c181705e","data_quality_score":0.83,"dimension_score":{"debt_dynamics":0.62,"fiscal_space":0.55,"interest_burden":0.28,"jgb_absorption":0.71,"monetary_fiscal_dominance":0.66},"dominant_drivers":["boj_jgb_share","primary_balance_to_gdp","real_policy_rate"],"methodology_version":"fixture-fre-methodology/1.0.0","notes":"架空の fixture snapshot。fiscal-regime-engine の実際の出力ではない。observed context としてのみ使い、shock magnitude の導出には使わない。","policy_version":"fixture-fre-policy/1.0.0","primary_regime":"FINANCIAL_REPRESSION","regime_affinity":{"FINANCIAL_REPRESSION":0.68,"FISCAL_CONSOLIDATION":0.44,"FISCAL_STRESS":0.39,"GROWTH_NORMALIZATION":0.31},"regime_confidence":0.58,"regime_determination":"primary","regime_share":{"FINANCIAL_REPRESSION":0.37,"FISCAL_CONSOLIDATION":0.24,"FISCAL_STRESS":0.22,"GROWTH_NORMALIZATION":0.17},"snapshot_id":"fre-fixture-jp-2026-09-30-primary","vintage_basis":"fixture:as-released"},"fre_context_identity":"sha256:29a8061e151be188076a455586fe85618fa232a5ed2e9a9148cd12d1c181705e","name":"財政再建（税は変化なしと明示）","notes":"","provenance":{"assumption_source":"fixture","capability_contract_version":"japan-fiscal-scenario-capability/1.0.0","claim_contract_version":"japan-fiscal-claim-contract/1.0.0","created_at":null,"created_by":"","schema_version":"japan-fiscal-scenario-schema/1.0.0"},"scenario_id":"jf-f2-explicit-zero-tax"}