{"assumption_set_hash":"sha256:d109b1519f8c0e6edba4138ecc7b6bded19f901c96c6c83dc57caca09d6568a4","assumptions":[{"assumption_id":"f3-policy-rate","concept":"policy_rate","direction":"down","magnitude":-0.25,"magnitude_source":"assumed_default","notes":"fixture の既定値（観測値ではない）。","unit":"%pt (annualized)"},{"assumption_id":"f3-cb-absorption","concept":"cb_jgb_absorption","direction":"up","magnitude":2,"magnitude_source":"assumed_default","notes":"fixture の既定値（観測値ではない）。","unit":"level（残高）または ratio to outstanding JGB"}],"content_hash":"sha256:7a0bab18886660ada68319cf28237f7773739696234b3ea97d6c74b04169a022","family":"financial_repression","fre_context":{"as_of":"2026-09-30","constraint_pressure":0.47,"context_identity":"sha256:29a8061e151be188076a455586fe85618fa232a5ed2e9a9148cd12d1c181705e","data_quality_score":0.83,"dimension_score":{"debt_dynamics":0.62,"fiscal_space":0.55,"interest_burden":0.28,"jgb_absorption":0.71,"monetary_fiscal_dominance":0.66},"dominant_drivers":["boj_jgb_share","primary_balance_to_gdp","real_policy_rate"],"methodology_version":"fixture-fre-methodology/1.0.0","notes":"架空の fixture snapshot。fiscal-regime-engine の実際の出力ではない。observed context としてのみ使い、shock magnitude の導出には使わない。","policy_version":"fixture-fre-policy/1.0.0","primary_regime":"FINANCIAL_REPRESSION","regime_affinity":{"FINANCIAL_REPRESSION":0.68,"FISCAL_CONSOLIDATION":0.44,"FISCAL_STRESS":0.39,"GROWTH_NORMALIZATION":0.31},"regime_confidence":0.58,"regime_determination":"primary","regime_share":{"FINANCIAL_REPRESSION":0.37,"FISCAL_CONSOLIDATION":0.24,"FISCAL_STRESS":0.22,"GROWTH_NORMALIZATION":0.17},"snapshot_id":"fre-fixture-jp-2026-09-30-primary","vintage_basis":"fixture:as-released"},"fre_context_identity":"sha256:29a8061e151be188076a455586fe85618fa232a5ed2e9a9148cd12d1c181705e","name":"金融抑圧（インフレ assumption 未指定）","notes":"","provenance":{"assumption_source":"fixture","capability_contract_version":"japan-fiscal-scenario-capability/1.0.0","claim_contract_version":"japan-fiscal-claim-contract/1.0.0","created_at":null,"created_by":"","schema_version":"japan-fiscal-scenario-schema/1.0.0"},"scenario_id":"jf-f3-missing-inflation"}