{"assumption_set_hash":"sha256:9ef31d2cd13a46fdffba0979a643ff9485101ae80121e72148fcb282fbf43ab3","assumptions":[{"assumption_id":"f2-spending","concept":"government_spending","direction":"down","magnitude":-2,"magnitude_source":"assumed_default","notes":"fixture の既定値（観測値ではない）。モデル単位の水準変化。","unit":"level または ratio to GDP"},{"assumption_id":"f2-tax","concept":"tax","direction":"up","magnitude":0.01,"magnitude_source":"assumed_default","notes":"fixture の既定値（観測値ではない）。SIM では比例税率 θ、IS-LM / AD-AS / Mundell-Fleming では定額税 T の変化として適用される（自動変換しない）。","unit":"ratio（税率）または level（定額税）"}],"content_hash":"sha256:4123535c2fe137447e0053649c918d0aa7eb01748ed9980f1a1b8c15742aa17e","family":"fiscal_consolidation","fre_context":{"as_of":"2026-09-30","constraint_pressure":null,"context_identity":"sha256:7c122c3f7a4783d83f409cacdf280246219c1bc6698dc735a3cc16ee780ad707","data_quality_score":null,"dimension_score":{"debt_dynamics":0.6,"fiscal_space":0.5},"dominant_drivers":[],"methodology_version":"fixture-fre-methodology/1.0.0","notes":"架空の fixture snapshot。fiscal-regime-engine の実際の出力ではない。observed context としてのみ使い、shock magnitude の導出には使わない。regime 判定ができない snapshot。評価できない archetype・dimension はキーごと欠く（0 で埋めない）。regime_confidence・constraint_pressure・data_quality_score は null。","policy_version":"fixture-fre-policy/1.0.0","primary_regime":null,"regime_affinity":{},"regime_confidence":null,"regime_determination":"unavailable","regime_share":{},"snapshot_id":"fre-fixture-jp-2026-09-30-unavailable","vintage_basis":"fixture:as-released"},"fre_context_identity":"sha256:7c122c3f7a4783d83f409cacdf280246219c1bc6698dc735a3cc16ee780ad707","name":"財政再建（FRE 判定不能）","notes":"","provenance":{"assumption_source":"fixture","capability_contract_version":"japan-fiscal-scenario-capability/1.0.0","claim_contract_version":"japan-fiscal-claim-contract/1.0.0","created_at":null,"created_by":"","schema_version":"japan-fiscal-scenario-schema/1.0.0"},"scenario_id":"jf-f2-fre-unavailable"}