{"assumption_set_hash":"sha256:1d185baaaa45945401220d9aa84919997992aeb1d97e015683410d28fa0d7874","assumptions":[{"assumption_id":"f5-long-rate","concept":"long_rate_funding_condition","direction":"up","magnitude":50,"magnitude_source":"assumed_default","notes":"fixture の既定値（観測値ではない）。","unit":"bp"}],"content_hash":"sha256:e19bbca4d880fbfe3dab023639ff9ea2ffa3a83b67d042bb52d6fd27be079a0e","family":"jgb_funding_cost","fre_context":null,"fre_context_identity":null,"name":"JGB funding-cost（FRE context なし）","notes":"observed context を持たない scenario。","provenance":{"assumption_source":"fixture","capability_contract_version":"japan-fiscal-scenario-capability/1.0.0","claim_contract_version":"japan-fiscal-claim-contract/1.0.0","created_at":null,"created_by":"","schema_version":"japan-fiscal-scenario-schema/1.0.0"},"scenario_id":"jf-f5-no-fre"}