{"assumption_set_hash":"sha256:8e11ed3c572cd0ac2890f562d15895acb11a5c09c36ca06c9de8ce1ba37f5dac","assumptions":[{"assumption_id":"f1-growth","concept":"growth_path","direction":"down","magnitude":-0.5,"magnitude_source":"assumed_default","notes":"fixture の既定値（観測値ではない）。GDP 成長率パス（どのモデルも受け取らない。G-03）。","unit":"%pt (annualized growth rate)"},{"assumption_id":"f1-policy-rate","concept":"policy_rate","direction":"up","magnitude":0.5,"magnitude_source":"assumed_default","notes":"fixture の既定値（観測値ではない）。","unit":"%pt (annualized)"},{"assumption_id":"f1-long-rate","concept":"long_rate_funding_condition","direction":"up","magnitude":30,"magnitude_source":"assumed_default","notes":"fixture の既定値（観測値ではない）。","unit":"bp"}],"content_hash":"sha256:dbf39978fe5bd2de1bd638d9f1760d24b5fa5f4734cfb06b053a072f02513a4f","family":"low_growth_high_rates","fre_context":{"as_of":"2026-09-30","constraint_pressure":0.47,"context_identity":"sha256:29a8061e151be188076a455586fe85618fa232a5ed2e9a9148cd12d1c181705e","data_quality_score":0.83,"dimension_score":{"debt_dynamics":0.62,"fiscal_space":0.55,"interest_burden":0.28,"jgb_absorption":0.71,"monetary_fiscal_dominance":0.66},"dominant_drivers":["boj_jgb_share","primary_balance_to_gdp","real_policy_rate"],"methodology_version":"fixture-fre-methodology/1.0.0","notes":"架空の fixture snapshot。fiscal-regime-engine の実際の出力ではない。observed context としてのみ使い、shock magnitude の導出には使わない。","policy_version":"fixture-fre-policy/1.0.0","primary_regime":"FINANCIAL_REPRESSION","regime_affinity":{"FINANCIAL_REPRESSION":0.68,"FISCAL_CONSOLIDATION":0.44,"FISCAL_STRESS":0.39,"GROWTH_NORMALIZATION":0.31},"regime_confidence":0.58,"regime_determination":"primary","regime_share":{"FINANCIAL_REPRESSION":0.37,"FISCAL_CONSOLIDATION":0.24,"FISCAL_STRESS":0.22,"GROWTH_NORMALIZATION":0.17},"snapshot_id":"fre-fixture-jp-2026-09-30-primary","vintage_basis":"fixture:as-released"},"fre_context_identity":"sha256:29a8061e151be188076a455586fe85618fa232a5ed2e9a9148cd12d1c181705e","name":"低成長 + 高金利（基準ケース）","notes":"","provenance":{"assumption_source":"fixture","capability_contract_version":"japan-fiscal-scenario-capability/1.0.0","claim_contract_version":"japan-fiscal-claim-contract/1.0.0","created_at":null,"created_by":"","schema_version":"japan-fiscal-scenario-schema/1.0.0"},"scenario_id":"jf-f1-base"}