{"assumption_set_hash":"sha256:9ef31d2cd13a46fdffba0979a643ff9485101ae80121e72148fcb282fbf43ab3","assumptions":[{"assumption_id":"f2-spending","concept":"government_spending","direction":"down","magnitude":-2,"magnitude_source":"assumed_default","notes":"fixture の既定値（観測値ではない）。モデル単位の水準変化。","unit":"level または ratio to GDP"},{"assumption_id":"f2-tax","concept":"tax","direction":"up","magnitude":0.01,"magnitude_source":"assumed_default","notes":"fixture の既定値（観測値ではない）。SIM では比例税率 θ、IS-LM / AD-AS / Mundell-Fleming では定額税 T の変化として適用される（自動変換しない）。","unit":"ratio（税率）または level（定額税）"}],"content_hash":"sha256:0857ee8b34153c8f3c594d86748454da32021eda313d8a86173aa0c6c5b0b946","family":"fiscal_consolidation","fre_context":{"as_of":"2026-09-30","constraint_pressure":0.96,"context_identity":"sha256:b323b4ba7c78c6222284d4f1a1b827c611328135397c766f528659fa40ddbfdc","data_quality_score":0.99,"dimension_score":{"debt_dynamics":0.97,"fiscal_space":0.91,"interest_burden":0.88,"jgb_absorption":0.94,"monetary_fiscal_dominance":0.35},"dominant_drivers":["debt_to_gdp","effective_debt_rate","interest_to_revenue"],"methodology_version":"fixture-fre-methodology/1.0.0","notes":"架空の fixture snapshot。fiscal-regime-engine の実際の出力ではない。observed context としてのみ使い、shock magnitude の導出には使わない。fre_primary と assumption 集合を共有し、affinity / share / confidence / dimension score / constraint pressure だけを大きく変えた検証用 snapshot。","policy_version":"fixture-fre-policy/1.0.0","primary_regime":"FISCAL_STRESS","regime_affinity":{"FINANCIAL_REPRESSION":0.41,"FISCAL_CONSOLIDATION":0.12,"FISCAL_STRESS":0.97,"GROWTH_NORMALIZATION":0.05},"regime_confidence":0.95,"regime_determination":"primary","regime_share":{"FINANCIAL_REPRESSION":0.27,"FISCAL_CONSOLIDATION":0.08,"FISCAL_STRESS":0.62,"GROWTH_NORMALIZATION":0.03},"snapshot_id":"fre-fixture-jp-2026-09-30-shifted","vintage_basis":"fixture:as-released"},"fre_context_identity":"sha256:b323b4ba7c78c6222284d4f1a1b827c611328135397c766f528659fa40ddbfdc","name":"財政再建（FRE score だけを変えた context）","notes":"","provenance":{"assumption_source":"fixture","capability_contract_version":"japan-fiscal-scenario-capability/1.0.0","claim_contract_version":"japan-fiscal-claim-contract/1.0.0","created_at":null,"created_by":"","schema_version":"japan-fiscal-scenario-schema/1.0.0"},"scenario_id":"jf-f2-fre-shifted"}