{"assumption_set_hash":"sha256:9ef31d2cd13a46fdffba0979a643ff9485101ae80121e72148fcb282fbf43ab3","assumptions":[{"assumption_id":"f2-spending","concept":"government_spending","direction":"down","magnitude":-2,"magnitude_source":"assumed_default","notes":"fixture の既定値（観測値ではない）。モデル単位の水準変化。","unit":"level または ratio to GDP"},{"assumption_id":"f2-tax","concept":"tax","direction":"up","magnitude":0.01,"magnitude_source":"assumed_default","notes":"fixture の既定値（観測値ではない）。SIM では比例税率 θ、IS-LM / AD-AS / Mundell-Fleming では定額税 T の変化として適用される（自動変換しない）。","unit":"ratio（税率）または level（定額税）"}],"content_hash":"sha256:b754e28349777db280259038791501dbe32079370ffe708b498a0db7286ccbf8","family":"fiscal_consolidation","fre_context":null,"fre_context_identity":null,"name":"財政再建（FRE context なし）","notes":"observed context を持たない scenario。","provenance":{"assumption_source":"fixture","capability_contract_version":"japan-fiscal-scenario-capability/1.0.0","claim_contract_version":"japan-fiscal-claim-contract/1.0.0","created_at":null,"created_by":"","schema_version":"japan-fiscal-scenario-schema/1.0.0"},"scenario_id":"jf-f2-no-fre"}